{"naturalLanguageAnswer":"Found 5 voicing(s) for 'Analyze this progression: Dm7 G7 Cmaj7':\n  • A (x-0-2-2-2-0) - Score: 0.45\n    This voicing incorporates shell-voicing, rootless, open-voicing, closed-voicing, dense, resonant, register:low, register:mid-low, register:mid, register:mid-high, register:high techniques and reflects open-position, barre-chord, Ionian flavor characteristics.\n  • A7 (x-0-2-0-2-0) - Score: 0.44\n    This voicing incorporates shell-voicing, rootless, open-voicing, closed-voicing, dense, resonant, register:low, register:mid-low, register:mid, register:mid-high, register:high, beginner-friendly, campfire-chord techniques and reflects open-position, Mixolydian flavor, Phrygian dominant flavor, Lydian dominant flavor characteristics.\n  • Am9 (5-x-5-5-x-x) - Score: 0.43\n    This voicing incorporates shell-voicing, rootless, open-voicing, closed-voicing, dense, resonant, register:low, register:mid-low, register:mid, register:mid-high, register:high techniques and reflects low-position, Aeolian flavor, Blues flavor characteristics.\n  • E7#9 (0-7-6-7-8-0) - Score: 0.41\n    This voicing incorporates shell-voicing, rootless, open-voicing, closed-voicing, dense, resonant, register:low, register:mid-low, register:mid, register:mid-high, register:high, beginner-friendly, campfire-chord techniques and reflects tapping, hybrid-picking, string-skipping, economy-picking, hendrix-chord, purple-haze-chord, e7#9, james-bond-chord, spy-chord, em(maj7), minor-major-7th, tristan-chord, wagner-chord, tristan-dissonance, mystic-chord, prometheus-chord, scriabin-chord, so-what-chord, evans-chord, em11, quartal-voicing, mu-major-chord, mu-chord, add9(no3), steely-dan-chord, elektra-chord, strauss-chord, petrushka-chord, stravinsky-chord, bitonal-chord, cowboy-chord, open-g, g-major, power-chord, fifth-chord, g5, joni-mitchell-chord, mitchell-voicing, open-tuning-chord, blackbird-chord, beatles-chord, g/b, alternate-picking, crosspicking, harmonics-(natural/artificial/pinch/tap), raking, slides-&-portamento, middle-position, Altered flavor characteristics.\n  • Am (x-0-2-2-1-0) - Score: 0.38\n    This voicing incorporates shell-voicing, rootless, open-voicing, closed-voicing, dense, resonant, register:low, register:mid-low, register:mid, register:mid-high, register:high, beginner-friendly, campfire-chord techniques and reflects open-position, Aeolian flavor, Blues flavor characteristics.\n\n(I have attached the analyze progression for you to play!)","candidates":[{"id":"voicing_m_0_2_2_2_0","displayName":"A","shape":"x-0-2-2-2-0","score":0.4513962041283786,"explanationFacts":{"summary":"This voicing incorporates shell-voicing, rootless, open-voicing, closed-voicing, dense, resonant, register:low, register:mid-low, register:mid, register:mid-high, register:high techniques and reflects open-position, barre-chord, Ionian flavor characteristics.","tags":["shell-voicing","rootless","open-voicing","closed-voicing","dense","resonant","register:low","register:mid-low","register:mid","register:mid-high","register:high","open-position","barre-chord","Flavor:Ionian"],"techniques":["shell-voicing","rootless","open-voicing","closed-voicing","dense","resonant","register:low","register:mid-low","register:mid","register:mid-high","register:high"],"styles":["open-position","barre-chord","Ionian flavor"],"spectralCentroid":2.0408564767205197},"explanationText":"This voicing incorporates shell-voicing, rootless, open-voicing, closed-voicing, dense, resonant, register:low, register:mid-low, register:mid, register:mid-high, register:high techniques and reflects open-position, barre-chord, Ionian flavor characteristics."},{"id":"voicing_m_0_2_0_2_0","displayName":"A7","shape":"x-0-2-0-2-0","score":0.44237757004870953,"explanationFacts":{"summary":"This voicing incorporates shell-voicing, rootless, open-voicing, closed-voicing, dense, resonant, register:low, register:mid-low, register:mid, register:mid-high, register:high, beginner-friendly, campfire-chord techniques and reflects open-position, Mixolydian flavor, Phrygian dominant flavor, Lydian dominant flavor characteristics.","tags":["shell-voicing","rootless","open-voicing","closed-voicing","dense","resonant","register:low","register:mid-low","register:mid","register:mid-high","register:high","beginner-friendly","campfire-chord","open-position","Flavor:Mixolydian","Flavor:Phrygian dominant","Flavor:Lydian dominant"],"techniques":["shell-voicing","rootless","open-voicing","closed-voicing","dense","resonant","register:low","register:mid-low","register:mid","register:mid-high","register:high","beginner-friendly","campfire-chord"],"styles":["open-position","Mixolydian flavor","Phrygian dominant flavor","Lydian dominant flavor"],"spectralCentroid":1.899483084283978},"explanationText":"This voicing incorporates shell-voicing, rootless, open-voicing, closed-voicing, dense, resonant, register:low, register:mid-low, register:mid, register:mid-high, register:high, beginner-friendly, campfire-chord techniques and reflects open-position, Mixolydian flavor, Phrygian dominant flavor, Lydian dominant flavor characteristics."},{"id":"voicing_5_m_5_5_m_m","displayName":"Am9","shape":"5-x-5-5-x-x","score":0.4268862806606204,"explanationFacts":{"summary":"This voicing incorporates shell-voicing, rootless, open-voicing, closed-voicing, dense, resonant, register:low, register:mid-low, register:mid, register:mid-high, register:high techniques and reflects low-position, Aeolian flavor, Blues flavor characteristics.","tags":["shell-voicing","rootless","open-voicing","closed-voicing","dense","resonant","register:low","register:mid-low","register:mid","register:mid-high","register:high","low-position","Flavor:Aeolian","Flavor:Blues"],"techniques":["shell-voicing","rootless","open-voicing","closed-voicing","dense","resonant","register:low","register:mid-low","register:mid","register:mid-high","register:high"],"styles":["low-position","Aeolian flavor","Blues flavor"],"spectralCentroid":0.701758821744515},"explanationText":"This voicing incorporates shell-voicing, rootless, open-voicing, closed-voicing, dense, resonant, register:low, register:mid-low, register:mid, register:mid-high, register:high techniques and reflects low-position, Aeolian flavor, Blues flavor characteristics."},{"id":"voicing_0_7_6_7_8_0","displayName":"E7#9","shape":"0-7-6-7-8-0","score":0.4071230513063313,"explanationFacts":{"summary":"This voicing incorporates shell-voicing, rootless, open-voicing, closed-voicing, dense, resonant, register:low, register:mid-low, register:mid, register:mid-high, register:high, beginner-friendly, campfire-chord techniques and reflects tapping, hybrid-picking, string-skipping, economy-picking, hendrix-chord, purple-haze-chord, e7#9, james-bond-chord, spy-chord, em(maj7), minor-major-7th, tristan-chord, wagner-chord, tristan-dissonance, mystic-chord, prometheus-chord, scriabin-chord, so-what-chord, evans-chord, em11, quartal-voicing, mu-major-chord, mu-chord, add9(no3), steely-dan-chord, elektra-chord, strauss-chord, petrushka-chord, stravinsky-chord, bitonal-chord, cowboy-chord, open-g, g-major, power-chord, fifth-chord, g5, joni-mitchell-chord, mitchell-voicing, open-tuning-chord, blackbird-chord, beatles-chord, g/b, alternate-picking, crosspicking, harmonics-(natural/artificial/pinch/tap), raking, slides-&-portamento, middle-position, Altered flavor characteristics.","tags":["shell-voicing","rootless","open-voicing","closed-voicing","dense","resonant","register:low","register:mid-low","register:mid","register:mid-high","register:high","beginner-friendly","campfire-chord","tapping","hybrid-picking","string-skipping","economy-picking","hendrix-chord","purple-haze-chord","e7#9","james-bond-chord","spy-chord","em(maj7)","minor-major-7th","tristan-chord","wagner-chord","tristan-dissonance","mystic-chord","prometheus-chord","scriabin-chord","so-what-chord","evans-chord","em11","quartal-voicing","mu-major-chord","mu-chord","add9(no3)","steely-dan-chord","elektra-chord","strauss-chord","petrushka-chord","stravinsky-chord","bitonal-chord","cowboy-chord","open-g","g-major","power-chord","fifth-chord","g5","joni-mitchell-chord","mitchell-voicing","open-tuning-chord","blackbird-chord","beatles-chord","g/b","alternate-picking","crosspicking","harmonics-(natural/artificial/pinch/tap)","raking","slides-&-portamento","middle-position","Flavor:Altered"],"techniques":["shell-voicing","rootless","open-voicing","closed-voicing","dense","resonant","register:low","register:mid-low","register:mid","register:mid-high","register:high","beginner-friendly","campfire-chord"],"styles":["tapping","hybrid-picking","string-skipping","economy-picking","hendrix-chord","purple-haze-chord","e7#9","james-bond-chord","spy-chord","em(maj7)","minor-major-7th","tristan-chord","wagner-chord","tristan-dissonance","mystic-chord","prometheus-chord","scriabin-chord","so-what-chord","evans-chord","em11","quartal-voicing","mu-major-chord","mu-chord","add9(no3)","steely-dan-chord","elektra-chord","strauss-chord","petrushka-chord","stravinsky-chord","bitonal-chord","cowboy-chord","open-g","g-major","power-chord","fifth-chord","g5","joni-mitchell-chord","mitchell-voicing","open-tuning-chord","blackbird-chord","beatles-chord","g/b","alternate-picking","crosspicking","harmonics-(natural/artificial/pinch/tap)","raking","slides-&-portamento","middle-position","Altered flavor"],"spectralCentroid":1.6895033161081123},"explanationText":"This voicing incorporates shell-voicing, rootless, open-voicing, closed-voicing, dense, resonant, register:low, register:mid-low, register:mid, register:mid-high, register:high, beginner-friendly, campfire-chord techniques and reflects tapping, hybrid-picking, string-skipping, economy-picking, hendrix-chord, purple-haze-chord, e7#9, james-bond-chord, spy-chord, em(maj7), minor-major-7th, tristan-chord, wagner-chord, tristan-dissonance, mystic-chord, prometheus-chord, scriabin-chord, so-what-chord, evans-chord, em11, quartal-voicing, mu-major-chord, mu-chord, add9(no3), steely-dan-chord, elektra-chord, strauss-chord, petrushka-chord, stravinsky-chord, bitonal-chord, cowboy-chord, open-g, g-major, power-chord, fifth-chord, g5, joni-mitchell-chord, mitchell-voicing, open-tuning-chord, blackbird-chord, beatles-chord, g/b, alternate-picking, crosspicking, harmonics-(natural/artificial/pinch/tap), raking, slides-&-portamento, middle-position, Altered flavor characteristics."},{"id":"voicing_m_0_2_2_1_0","displayName":"Am","shape":"x-0-2-2-1-0","score":0.3828242112969294,"explanationFacts":{"summary":"This voicing incorporates shell-voicing, rootless, open-voicing, closed-voicing, dense, resonant, register:low, register:mid-low, register:mid, register:mid-high, register:high, beginner-friendly, campfire-chord techniques and reflects open-position, Aeolian flavor, Blues flavor characteristics.","tags":["shell-voicing","rootless","open-voicing","closed-voicing","dense","resonant","register:low","register:mid-low","register:mid","register:mid-high","register:high","beginner-friendly","campfire-chord","open-position","Flavor:Aeolian","Flavor:Blues"],"techniques":["shell-voicing","rootless","open-voicing","closed-voicing","dense","resonant","register:low","register:mid-low","register:mid","register:mid-high","register:high","beginner-friendly","campfire-chord"],"styles":["open-position","Aeolian flavor","Blues flavor"],"spectralCentroid":1.6243349524675708},"explanationText":"This voicing incorporates shell-voicing, rootless, open-voicing, closed-voicing, dense, resonant, register:low, register:mid-low, register:mid, register:mid-high, register:high, beginner-friendly, campfire-chord techniques and reflects open-position, Aeolian flavor, Blues flavor characteristics."}],"progression":{"id":"fde00771-ca54-4ee5-81c1-cc87a41045a3","name":"Extracted Progression","description":"Extracted from: Analyze this progression: Dm7 G7 Cmaj7","steps":[{"voicing":{"positions":[],"notes":[]},"durationMs":2000,"function":"","label":"Analyze"},{"voicing":{"positions":[],"notes":[]},"durationMs":2000,"function":"","label":"Dm7"},{"voicing":{"positions":[],"notes":[]},"durationMs":2000,"function":"","label":"G7"},{"voicing":{"positions":[],"notes":[]},"durationMs":2000,"function":"","label":"Cmaj7"}],"tags":["extracted","user-query"]},"debugParams":{"mode":"ParsedChord('Analyze this progression: Dm7 G7 Cmaj7')"}}